{
  "changes": [],
  "importId": "import-6p-minimal-single-aircraft",
  "lifecycle": {
    "referencedRunIds": [],
    "state": "draft",
    "version": 1
  },
  "objects": {
    "airports": [
      {
        "distanceToMissionKm": 180,
        "id": "airport0",
        "location": "最小案例起降点",
        "name": "airport0",
        "runwayType": "单一起降点",
        "supportNodeId": null
      }
    ],
    "analysisRequests": {
      "largeSample": {
        "enabled": true,
        "samples": 1,
        "sweep": {
          "failureRates": [
            0.02
          ],
          "spareMultipliers": [
            1.0
          ],
          "supportCapacities": [
            1
          ]
        }
      }
    },
    "equipment": {
      "deploymentLocation": "null",
      "initialReady": 1,
      "minRequiredSorties": 1,
      "model": "J-15",
      "preLifeRequirementHours": 120,
      "quantity": 1,
      "wholeMachineModels": [
        "J-15"
      ]
    },
    "equipmentAssets": [
      {
        "aircraftModel": "J-15",
        "failureDistribution": {
          "distributionType": "指数分布",
          "parameters": "lambda=0.05"
        },
        "failureRate": 0.05,
        "id": "whole-aircraft",
        "meanRepairTimeMinutes": 120,
        "mtbfHours": 20,
        "name": "全机",
        "productType": "整机",
        "quantity": 1,
        "repairDistribution": {
          "distributionType": "固定值",
          "parameters": "value=120"
        }
      }
    ],
    "experiment": {
      "name": "导入示例项目",
      "parallelCores": 4,
      "samples": 1,
      "seed": 20260621,
      "steps": 48,
      "stopCondition": "达到样本数或备件满足率稳定"
    },
    "missionAreas": [
      {
        "areaType": "制空",
        "distanceFromDepartureKm": 180,
        "id": "near-sea-cap",
        "name": "近海制空区",
        "patrolRadiusKm": 100,
        "threatLevel": "中"
      },
      {
        "areaType": "警戒",
        "distanceFromDepartureKm": 420,
        "id": "far-sea-alert",
        "name": "远海警戒区",
        "patrolRadiusKm": 160,
        "threatLevel": "高"
      }
    ],
    "missionProfiles": [
      {
        "airports": [
          {
            "distanceToMissionKm": 180,
            "id": "airport0",
            "location": "最小案例起降点",
            "name": "airport0",
            "runwayType": "单一起降点",
            "supportNodeId": null
          }
        ],
        "analysisRequests": {
          "largeSample": {
            "enabled": true,
            "samples": 1,
            "sweep": {
              "failureRates": [
                0.02
              ],
              "spareMultipliers": [
                1.0
              ],
              "supportCapacities": [
                1
              ]
            }
          }
        },
        "basicMission": {
          "advanceNoticeMinutes": 60,
          "cancelMinutes": 20,
          "equipmentQuantity": 1,
          "equipmentType": "J-15",
          "minRequiredSorties": 1,
          "missionId": "BM-CV-01",
          "name": "巡逻任务",
          "preparationMinutes": 50,
          "priority": 1,
          "returnRatio": 0.35,
          "startHour": 1,
          "successPoint": 0.95,
          "supportActivityName": "",
          "taskArea": "巡逻区",
          "taskDurationMinutes": 60,
          "taskNo": "BM-CV-01",
          "updatedAt": "2026-06-21 08:00"
        },
        "combatUnit": {
          "basicTaskName": "近海制空巡逻任务",
          "deploymentLocation": "航母飞行甲板",
          "equipmentType": "J-15 / J-35",
          "groupName": "航母第一出动编队",
          "members": [
            {
              "aircraftNo": "J15-6P-001",
              "deploymentLocation": "航母飞行甲板",
              "model": "J-15",
              "preLifeRequirementHours": 120,
              "remainingLifeHours": 180,
              "role": "长机",
              "status": "备用",
              "takeoffLandingCount": 36
            }
          ],
          "quantity": 6,
          "requiredCount": 5,
          "standbyCount": 1,
          "unitId": "CU-CV-01"
        },
        "compositeTasks": [
          {
            "id": "composite-6p-minimal",
            "name": "最小单机复合任务",
            "taskItems": [
              {
                "basicTaskName": "最小单机巡检任务",
                "dailyRepeatCount": 1,
                "equipmentQuantity": 1,
                "equipmentType": "J-15",
                "firstWaveTime": "08:00",
                "groupName": "单机编队",
                "id": "task-6p-minimal",
                "intervalHours": 6,
                "minRequiredSystems": 1,
                "preparationMinutes": 20,
                "priority": 1,
                "recoveryTime": "09:30",
                "requiredEquipmentQuantity": 1,
                "taskDispatchTime": "07:40"
              }
            ]
          }
        ],
        "durationHours": 6,
        "endCondition": "完成 1 个最小单机出动波次",
        "equipment": {
          "deploymentLocation": "null",
          "initialReady": 1,
          "minRequiredSorties": 1,
          "model": "J-15",
          "preLifeRequirementHours": 120,
          "quantity": 1,
          "wholeMachineModels": [
            "J-15"
          ]
        },
        "experiment": {
          "name": "导入示例项目",
          "parallelCores": 4,
          "samples": 1,
          "seed": 20260621,
          "steps": 48,
          "stopCondition": "达到样本数或备件满足率稳定"
        },
        "id": "mission-profile-6p-minimal",
        "missionAreas": [
          {
            "areaType": "制空",
            "distanceFromDepartureKm": 180,
            "id": "near-sea-cap",
            "name": "近海制空区",
            "patrolRadiusKm": 100,
            "threatLevel": "中"
          },
          {
            "areaType": "警戒",
            "distanceFromDepartureKm": 420,
            "id": "far-sea-alert",
            "name": "远海警戒区",
            "patrolRadiusKm": 160,
            "threatLevel": "高"
          }
        ],
        "missionPhases": [
          {
            "id": "phase-alert",
            "limitHours": 1,
            "name": "出航",
            "phaseRatio": 0.3,
            "state": "idle"
          },
          {
            "id": "phase-prep",
            "limitHours": 2,
            "name": "任务",
            "phaseRatio": 0.4,
            "state": "preparing"
          },
          {
            "id": "phase-sortie",
            "limitHours": 4,
            "name": "返航",
            "phaseRatio": 0.3,
            "state": "sortie"
          }
        ],
        "monteCarlo": {
          "failureRates": [
            0.02
          ],
          "minRequiredSorties": [
            1
          ],
          "spareMultipliers": [
            1.0
          ],
          "supportCapacities": [
            1
          ]
        },
        "name": "6P 最小单机任务剖面",
        "periodicTasks": [
          {
            "compositeTaskIds": [
              "composite-6p-minimal"
            ],
            "compositeTasks": [
              {
                "compositeTaskId": "composite-6p-minimal",
                "week": "1"
              }
            ],
            "cycleDays": 1,
            "id": "periodic-6p-minimal",
            "name": "单日最小周期任务",
            "periodDays": 1,
            "repeatCount": 1,
            "repeatCycleDays": 1,
            "repeatCycleUnit": "day",
            "repeatCycleValue": 1,
            "repeatRounds": 1,
            "repeatWeeks": 1,
            "taskName": "单日最小周期任务",
            "weekdayAssignments": {
              "monday": "composite-6p-minimal"
            }
          }
        ],
        "profileId": "MP-CV-01",
        "profileType": "舰载机昼夜连续出动",
        "reliabilityBlockDiagram": {
          "edges": [],
          "nodes": [
            {
              "connectionType": "串联",
              "failureDistribution": {
                "distributionType": "指数分布",
                "parameters": "lambda=0.05"
              },
              "failureRate": 0.05,
              "id": "whole-aircraft",
              "meanRepairTimeMinutes": 120,
              "mtbfHours": 20,
              "name": "全机",
              "parentId": null,
              "repairDistribution": {
                "distributionType": "固定值",
                "parameters": "value=120"
              },
              "type": "system"
            }
          ]
        },
        "repeatCycleHours": 6
      }
    ],
    "monteCarlo": {
      "failureRates": [
        0.02
      ],
      "minRequiredSorties": [
        1
      ],
      "spareMultipliers": [
        1.0
      ],
      "supportCapacities": [
        1
      ]
    },
    "projectInfo": {
      "baseCode": "IMPORTED-001",
      "name": "导入示例项目",
      "summary": "由建模导入 JSON 生成的完整页面测试项目"
    },
    "reliabilityBlockDiagram": {
      "edges": [],
      "nodes": [
        {
          "connectionType": "串联",
          "failureDistribution": {
            "distributionType": "指数分布",
            "parameters": "lambda=0.05"
          },
          "failureRate": 0.05,
          "id": "whole-aircraft",
          "meanRepairTimeMinutes": 120,
          "mtbfHours": 20,
          "name": "全机",
          "parentId": null,
          "repairDistribution": {
            "distributionType": "固定值",
            "parameters": "value=120"
          },
          "type": "system"
        }
      ]
    },
    "supportActivities": [
      {
        "activityName": "空保障活动",
        "activityType": "保障活动",
        "corrective": {},
        "durationHours": 0.5,
        "equipmentId": "whole-aircraft",
        "id": "empty-support-activity",
        "jobs": [],
        "logistics": {},
        "name": "空保障活动",
        "organizationStrategies": [],
        "planType": "",
        "preventive": {},
        "requiredDevices": null,
        "requiredPersonnel": null,
        "resourceId": "carrier-deck",
        "spareQuantity": 0,
        "spareType": "",
        "transportStrategies": []
      }
    ],
    "supportOrganization": {
      "tree": [
        {